title;DOI;task;type;max component;max coordinative;max dynamic;assigend risk;assigned expertise;proxy or actual;risk;required expertise;justification;year
Understanding the Role of Explanation Modality in AI-assisted Decision-making;https://dl.acm.org/doi/10.1145/3503252.3531311;credibility assessment of text;multi;6;4;0;0;0;actual;not mentioned;not mentioned;no;2022
Who Goes First? Influences of Human-AI Workflow on Decision Making in Clinical Imaging;https://dl.acm.org/doi/10.1145/3531146.3533193;clinical image classification;binary;6;240;0;1;1;actual;high;radiologist;no;2022
On Human Predictions with Explanations and Predictions of Machine Learning Models: A Case Study on Deception Detection;https://dl.acm.org/doi/10.1145/3287560.3287590;deception detection;binary ;4;20;0;1;0;actual;high;not mentioned;yes;2019
It’s Just Not That Simple: An Empirical Study of the Accuracy-Explainability Trade-off in Machine Learning for Public Policy;https://dl.acm.org/doi/10.1145/3531146.3533090;house and eduction;binary;10;4;0;1;1;proxy;high;expert in education and real state;no;2022
A User Study on Groups Interacting with Tourist Trip Recommender Systems in Public Spaces;https://dl.acm.org/doi/10.1145/3320435.3320449;POI recommendation for tourist group;recoms;51;12;0;0;0;actual;not mentioned;not mentioned;yes;2019
Evaluating Visual Explanations for Similarity-Based Recommendations: User Perception and Performance;https://dl.acm.org/doi/10.1145/3320435.3320465;attendee component recommeder - conference navigator;recoms;12;30;0;0;0;actual;not mentioned;non experts - no prior knowledge required;no;2019
Using Explanations as Energy-Saving Frames: A User-Centric Recommender Study;https://dl.acm.org/doi/10.1145/3450614.3464477;energy-saving measure recommendation;recoms;9;20;0;0;0;actual;not mentioned;different level of expertise;somehow;2021
Factors Influencing Perceived Fairness in Algorithmic Decision-Making: Algorithm Outcomes, Development Procedures, and Individual Differences;https://dl.acm.org/doi/10.1145/3313831.3376813;master crowd worker qualification ;binary;8;1;0;1;0;proxy;not mentioned;crowdworkers - laypeople;no;2020
FlexNav: Flexible Navigation and Exploration through Connected Runnable Zones;https://dl.acm.org/doi/10.1145/3491102.3502051;running zone recommendation;multi;9;-1;-1000;0;0;actual;not mentioned;people with different habit of running;yes;2022
Showing Academic Performance Predictions during Term Planning: Effects on Students’ Decisions, Behaviors, and Preferences;https://dl.acm.org/doi/10.1145/3411764.3445718;academic performance predictions - course recommendation;recoms;27;5;-1000;1;1;actual;high;students from different curricula - All have had prior academic advising and were at different stages of their degree;yes;2021
To Trust or to Stockpile: Modeling Human-Simulation Interaction in Supply Chain Shortages;https://dl.acm.org/doi/10.1145/3491102.3502089;drug shortage prediction in supply chain;binary;15;70;0;1;0;actual;high;at least undergrad crowdworkers;yes;2022
When Confidence Meets Accuracy: Exploring the Effects of Multiple Performance Indicators on Trust in Machine Learning Models;https://dl.acm.org/doi/10.1145/3491102.3501967;speed dating event prediction;binay;24;80;0;0;0;actual;low;laypeople;somehow;2022
A Hybrid Approach to Identifying Unknown Unknowns of Predictive Models;https://ojs.aaai.org/index.php/HCOMP/article/view/5274;data labeling;multi;5;10;0;0;0;actual;not mentioned;crowd workers;somehow;2019
Algorithmic Risk Assessments Can Alter Human Decision-Making Processes in High-Stakes Government Contexts;https://dl.acm.org/doi/10.1145/3479562;pretrial setting and a home improvement loans setting;binary;14;40;0;1;1;actual;high;laypeople;somehow;2021
Human Evaluation of Models Built for Interpretability;https://ojs.aaai.org/index.php/HCOMP/article/view/5280;a low-risk recipe recommendation domain, and a high-risk clinical domain (drug recommendation);recoms;21;33;0;1;1;actual;high-low;laypeople;somehow;2019
Human-AI Collaboration for UX Evaluation: Effects of Explanation and Synchronization;https://dl.acm.org/doi/10.1145/3512943;usability test video evaluation in UX domain;recoms;9;2;0;0;1;actual;not metioned;ux/hci expert;yes;2022
Local Decision Pitfalls in Interactive Machine Learning: An Investigation into Feature Selection in Sentiment Analysis;https://dl.acm.org/doi/10.1145/3319616;sentiment analysis of movie reviews;binary;5;56;0;0;0;actual;not mentioned;people with different level in one study, cs people in another study;no;2019
“Rather Solve the Problem from Scratch”: Gamesploring Human-Machine Collaboration for Optimizing the Debris Collection Problem;https://dl.acm.org/doi/10.1145/3490099.3511163;assigning contractors to road segments for clearing debris in a disaster area;multi;13;3;-1000;1;1;actual;not mentioned;students with a background in math, engineering, and optimization problem;somehow;2022
RECAST: Enabling User Recourse and Interpretability of Toxicity Detection Models with Interactive Visualization;https://dl.acm.org/doi/10.1145/3449280;toxicity detection in the content moderation setting;binary;6;8;0;0;0;actual;not mentioned;not mentioned;yes;2021
S(C)ENTINEL: monitoring automated vehicles with olfactory reliability displays;https://dl.acm.org/doi/10.1145/3301275.3302332;automated driving scenario;binary;6;24;0;1;1;actual;not mentioned;not mentioned;yes;2019
The Effects of Meaningful and Meaningless Explanations on Trust and Perceived System Accuracy in Intelligent Systems;https://ojs.aaai.org/index.php/HCOMP/article/view/5284;image classification between images of cats and dogs;binary;4;90;0;0;0;proxy;not mentioned;students with different level of background in ML ;no;2019
The Impact of Algorithmic Risk Assessments on Human Predictions and its Analysis via Crowdsourcing Studies;https://dl.acm.org/doi/10.1145/3479572;recidivism prediction = predicting future re-arrests;binary-multi;11;80;0;1;1;actual;high;not mentioned;somehow;2021
Understanding the Effects of Explanation Types and User Motivations on Recommender System Use;https://ojs.aaai.org/index.php/HCOMP/article/view/7466;movie recommendationon;recoms;4;15;0;0;0;actual;not mentioned;not mentioned;somehow;2020
WeBuildAI: Participatory Framework for Algorithmic Governance;https://dl.acm.org/doi/10.1145/3359283;on-demand food donation matching - recommend recipient organizations;recoms;21;412;0;1;1;actual;not mentioned;people with different role in this context;yes;2019